{
  "languageId": "dendi",
  "name": "Dendi",
  "nativeName": "Dendi",
  "characters": [
    { "keyId": "key-a", "baseChar": "a", "shiftChar": "A" },
    { "keyId": "key-b", "baseChar": "b", "shiftChar": "B" },
    { "keyId": "key-c", "baseChar": "c", "shiftChar": "C" },
    { "keyId": "key-d", "baseChar": "d", "shiftChar": "D" },
    { "keyId": "key-e", "baseChar": "e", "shiftChar": "E", "altGrChar": "ɛ" },
    { "keyId": "key-f", "baseChar": "f", "shiftChar": "F" },
    { "keyId": "key-g", "baseChar": "g", "shiftChar": "G" },
    { "keyId": "key-h", "baseChar": "h", "shiftChar": "H" },
    { "keyId": "key-i", "baseChar": "i", "shiftChar": "I" },
    { "keyId": "key-j", "baseChar": "j", "shiftChar": "J" },
    { "keyId": "key-k", "baseChar": "k", "shiftChar": "K" },
    { "keyId": "key-l", "baseChar": "l", "shiftChar": "L" },
    { "keyId": "key-m", "baseChar": "m", "shiftChar": "M" },
    { "keyId": "key-n", "baseChar": "n", "shiftChar": "N", "altGrChar": "ŋ" },
    { "keyId": "key-o", "baseChar": "o", "shiftChar": "O", "altGrChar": "ɔ" },
    { "keyId": "key-p", "baseChar": "p", "shiftChar": "P" },
    { "keyId": "key-q", "baseChar": "q", "shiftChar": "Q" },
    { "keyId": "key-r", "baseChar": "r", "shiftChar": "R" },
    { "keyId": "key-s", "baseChar": "s", "shiftChar": "S" },
    { "keyId": "key-t", "baseChar": "t", "shiftChar": "T" },
    { "keyId": "key-u", "baseChar": "u", "shiftChar": "U" },
    { "keyId": "key-v", "baseChar": "v", "shiftChar": "V" },
    { "keyId": "key-w", "baseChar": "w", "shiftChar": "W" },
    { "keyId": "key-x", "baseChar": "x", "shiftChar": "X" },
    { "keyId": "key-y", "baseChar": "y", "shiftChar": "Y" },
    { "keyId": "key-z", "baseChar": "z", "shiftChar": "Z" },
    { "keyId": "key-e-dot", "baseChar": "ɛ", "shiftChar": "Ɛ" },
    { "keyId": "key-o-dot", "baseChar": "ɔ", "shiftChar": "Ɔ" }
  ],
  "compositionRules": [
    { "trigger": "´", "base": "a",  "result": "á",  "mode": "tone" },
    { "trigger": "´", "base": "e",  "result": "é",  "mode": "tone" },
    { "trigger": "´", "base": "ɛ",  "result": "ɛ́",  "mode": "tone" },
    { "trigger": "´", "base": "i",  "result": "í",  "mode": "tone" },
    { "trigger": "´", "base": "o",  "result": "ó",  "mode": "tone" },
    { "trigger": "´", "base": "ɔ",  "result": "ɔ́",  "mode": "tone" },
    { "trigger": "´", "base": "u",  "result": "ú",  "mode": "tone" },
    { "trigger": "´", "base": "A",  "result": "Á",  "mode": "tone" },
    { "trigger": "´", "base": "E",  "result": "É",  "mode": "tone" },
    { "trigger": "´", "base": "Ɛ",  "result": "Ɛ́",  "mode": "tone" },
    { "trigger": "´", "base": "I",  "result": "Í",  "mode": "tone" },
    { "trigger": "´", "base": "O",  "result": "Ó",  "mode": "tone" },
    { "trigger": "´", "base": "Ɔ",  "result": "Ɔ́",  "mode": "tone" },
    { "trigger": "´", "base": "U",  "result": "Ú",  "mode": "tone" },
    { "trigger": "`", "base": "a",  "result": "à",  "mode": "tone" },
    { "trigger": "`", "base": "e",  "result": "è",  "mode": "tone" },
    { "trigger": "`", "base": "ɛ",  "result": "ɛ̀",  "mode": "tone" },
    { "trigger": "`", "base": "i",  "result": "ì",  "mode": "tone" },
    { "trigger": "`", "base": "o",  "result": "ò",  "mode": "tone" },
    { "trigger": "`", "base": "ɔ",  "result": "ɔ̀",  "mode": "tone" },
    { "trigger": "`", "base": "u",  "result": "ù",  "mode": "tone" },
    { "trigger": "`", "base": "A",  "result": "À",  "mode": "tone" },
    { "trigger": "`", "base": "E",  "result": "È",  "mode": "tone" },
    { "trigger": "`", "base": "Ɛ",  "result": "Ɛ̀",  "mode": "tone" },
    { "trigger": "`", "base": "I",  "result": "Ì",  "mode": "tone" },
    { "trigger": "`", "base": "O",  "result": "Ò",  "mode": "tone" },
    { "trigger": "`", "base": "Ɔ",  "result": "Ɔ̀",  "mode": "tone" },
    { "trigger": "`", "base": "U",  "result": "Ù",  "mode": "tone" }
  ]
}
