{
  "languageId": "fon-adja",
  "name": "Fon/Adja",
  "nativeName": "Fɔngbè / Ajagbe",
  "characters": [
    { "keyId": "key-a", "baseChar": "a", "shiftChar": "A", "longPress": ["á", "à", "ã"] },
    { "keyId": "key-b", "baseChar": "b", "shiftChar": "B" },
    { "keyId": "key-c", "baseChar": "c", "shiftChar": "C" },
    { "keyId": "key-d", "baseChar": "d", "shiftChar": "D", "altGrChar": "ɖ", "longPress": ["ɖ"] },
    {
      "keyId": "key-e",
      "baseChar": "e",
      "shiftChar": "E",
      "altGrChar": "ɛ",
      "longPress": ["é", "è", "ẽ"]
    },
    { "keyId": "key-f", "baseChar": "f", "shiftChar": "F" },
    {
      "keyId": "key-g",
      "baseChar": "g",
      "shiftChar": "G",
      "altGrChar": "ɣ",
      "longPress": ["gb", "ɣ"]
    },
    { "keyId": "key-h", "baseChar": "h", "shiftChar": "H" },
    { "keyId": "key-i", "baseChar": "i", "shiftChar": "I", "longPress": ["í", "ì", "ĩ"] },
    { "keyId": "key-j", "baseChar": "j", "shiftChar": "J" },
    { "keyId": "key-k", "baseChar": "k", "shiftChar": "K", "longPress": ["kp"] },
    { "keyId": "key-l", "baseChar": "l", "shiftChar": "L" },
    { "keyId": "key-m", "baseChar": "m", "shiftChar": "M" },
    { "keyId": "key-n", "baseChar": "n", "shiftChar": "N", "longPress": ["ny"] },
    {
      "keyId": "key-o",
      "baseChar": "o",
      "shiftChar": "O",
      "altGrChar": "ɔ",
      "longPress": ["ó", "ò", "õ"]
    },
    { "keyId": "key-p", "baseChar": "p", "shiftChar": "P" },
    { "keyId": "key-q", "baseChar": "q", "shiftChar": "Q" },
    { "keyId": "key-r", "baseChar": "r", "shiftChar": "R" },
    { "keyId": "key-s", "baseChar": "s", "shiftChar": "S" },
    { "keyId": "key-t", "baseChar": "t", "shiftChar": "T" },
    { "keyId": "key-u", "baseChar": "u", "shiftChar": "U", "longPress": ["ú", "ù", "ũ"] },
    { "keyId": "key-v", "baseChar": "v", "shiftChar": "V", "altGrChar": "ʋ", "longPress": ["ʋ"] },
    { "keyId": "key-w", "baseChar": "w", "shiftChar": "W" },
    { "keyId": "key-x", "baseChar": "x", "shiftChar": "X" },
    { "keyId": "key-y", "baseChar": "y", "shiftChar": "Y" },
    { "keyId": "key-z", "baseChar": "z", "shiftChar": "Z" },
    { "keyId": "key-e-dot", "baseChar": "ɛ", "shiftChar": "Ɛ", "longPress": ["ɛ́", "ɛ̀", "ɛ̃"] },
    { "keyId": "key-o-dot", "baseChar": "ɔ", "shiftChar": "Ɔ", "longPress": ["ɔ́", "ɔ̀", "ɔ̃"] }
  ],
  "compositionRules": [
    { "trigger": "´", "base": "a", "result": "á", "mode": "tone" },
    { "trigger": "´", "base": "e", "result": "é", "mode": "tone" },
    { "trigger": "´", "base": "ɛ", "result": "ɛ́", "mode": "tone" },
    { "trigger": "´", "base": "i", "result": "í", "mode": "tone" },
    { "trigger": "´", "base": "o", "result": "ó", "mode": "tone" },
    { "trigger": "´", "base": "ɔ", "result": "ɔ́", "mode": "tone" },
    { "trigger": "´", "base": "u", "result": "ú", "mode": "tone" },
    { "trigger": "´", "base": "A", "result": "Á", "mode": "tone" },
    { "trigger": "´", "base": "E", "result": "É", "mode": "tone" },
    { "trigger": "´", "base": "Ɛ", "result": "Ɛ́", "mode": "tone" },
    { "trigger": "´", "base": "I", "result": "Í", "mode": "tone" },
    { "trigger": "´", "base": "O", "result": "Ó", "mode": "tone" },
    { "trigger": "´", "base": "Ɔ", "result": "Ɔ́", "mode": "tone" },
    { "trigger": "´", "base": "U", "result": "Ú", "mode": "tone" },
    { "trigger": "`", "base": "a", "result": "à", "mode": "tone" },
    { "trigger": "`", "base": "e", "result": "è", "mode": "tone" },
    { "trigger": "`", "base": "ɛ", "result": "ɛ̀", "mode": "tone" },
    { "trigger": "`", "base": "i", "result": "ì", "mode": "tone" },
    { "trigger": "`", "base": "o", "result": "ò", "mode": "tone" },
    { "trigger": "`", "base": "ɔ", "result": "ɔ̀", "mode": "tone" },
    { "trigger": "`", "base": "u", "result": "ù", "mode": "tone" },
    { "trigger": "`", "base": "A", "result": "À", "mode": "tone" },
    { "trigger": "`", "base": "E", "result": "È", "mode": "tone" },
    { "trigger": "`", "base": "Ɛ", "result": "Ɛ̀", "mode": "tone" },
    { "trigger": "`", "base": "I", "result": "Ì", "mode": "tone" },
    { "trigger": "`", "base": "O", "result": "Ò", "mode": "tone" },
    { "trigger": "`", "base": "Ɔ", "result": "Ɔ̀", "mode": "tone" },
    { "trigger": "`", "base": "U", "result": "Ù", "mode": "tone" },
    { "trigger": "~", "base": "a", "result": "ã", "mode": "nasal" },
    { "trigger": "~", "base": "e", "result": "ẽ", "mode": "nasal" },
    { "trigger": "~", "base": "ɛ", "result": "ɛ̃", "mode": "nasal" },
    { "trigger": "~", "base": "i", "result": "ĩ", "mode": "nasal" },
    { "trigger": "~", "base": "o", "result": "õ", "mode": "nasal" },
    { "trigger": "~", "base": "ɔ", "result": "ɔ̃", "mode": "nasal" },
    { "trigger": "~", "base": "u", "result": "ũ", "mode": "nasal" },
    { "trigger": "~", "base": "A", "result": "Ã", "mode": "nasal" },
    { "trigger": "~", "base": "E", "result": "Ẽ", "mode": "nasal" },
    { "trigger": "~", "base": "Ɛ", "result": "Ɛ̃", "mode": "nasal" },
    { "trigger": "~", "base": "I", "result": "Ĩ", "mode": "nasal" },
    { "trigger": "~", "base": "O", "result": "Õ", "mode": "nasal" },
    { "trigger": "~", "base": "Ɔ", "result": "Ɔ̃", "mode": "nasal" },
    { "trigger": "~", "base": "U", "result": "Ũ", "mode": "nasal" }
  ]
}
